{
  "schema_version": "1.0",
  "project_id": "aic-visual-event-platform",
  "phase": "M1F",
  "task_id": "TASK-0008",
  "task_version": 1,
  "task_hash": "sha256:d6ccb9643ce822b86a70ccb7016d896fc3cb37253f638bbec1dc0d84e248d74c",
  "iteration": 8,
  "status": "WAITING_FOR_MASTER",
  "last_actor": "codex",
  "next_actor": "chatgpt",
  "active_branch": "codex/task-0008-generic-action-primitives",
  "active_pr": 9,
  "last_commit": "3c0a9238564a16eba2e5a7520dc6aec6cf32d42c",
  "retry_count": 0,
  "review_round": 0,
  "consecutive_failures": 0,
  "human_required": false,
  "blocked_reason": null,
  "lock_owner": null,
  "lock_token": null,
  "lock_expires_at": null,
  "updated_at": "2026-09-25T05:44:34Z"
}
